{
  "$schema": "https://json-schema.org/draft/2020-12/schema",
  "title": "Opsly tenant onboarding config",
  "type": "object",
  "additionalProperties": false,
  "required": ["tenant_name", "tenant_slug", "schema_name", "platform_domain"],
  "properties": {
    "tenant_name": { "type": "string", "minLength": 1 },
    "tenant_slug": { "type": "string", "pattern": "^[a-z0-9][a-z0-9-]{1,28}[a-z0-9]$" },
    "schema_name": { "type": "string", "minLength": 1 },
    "platform_domain": { "type": "string", "minLength": 3 },
    "portal_domain": { "type": "string" },
    "parent_tenant_slug": {
      "type": "string",
      "pattern": "^[a-z0-9][a-z0-9-]{1,28}[a-z0-9]$"
    },
    "client_slug": {
      "type": "string",
      "pattern": "^[a-z0-9][a-z0-9-]{1,28}[a-z0-9]$"
    },
    "workflows_count": { "type": "integer", "minimum": 0 },
    "pricing_per_unit": { "type": "number", "minimum": 0 },
    "currency": { "type": "string", "minLength": 3, "maxLength": 3 },
    "notes": { "type": "string" },
    "public_url": { "type": "string", "format": "uri" },
    "internal_port": { "type": "integer", "minimum": 1, "maximum": 65535 },
    "stack_type": { "type": "string" },
    "brand_logo_path": { "type": "string" },
    "staff_login_path": { "type": "string" },
    "invite_email_subject": { "type": "string" },
    "pattern_ids": {
      "type": "array",
      "items": { "type": "string", "minLength": 1 },
      "description": "Pattern catalog ids — see config/patterns/tenant/"
    },
    "capabilities": {
      "type": "array",
      "items": { "type": "string" },
      "description": "Explicit capability flags; merged with pattern_ids at runtime"
    },
    "modules": {
      "type": "array",
      "items": { "type": "string" },
      "description": "Opsly lib modules; merged from pattern catalog"
    },
    "harness_patterns": {
      "type": "array",
      "items": { "type": "string" },
      "description": "Default harness pattern ids for sigma:start_decision"
    }
  }
}
