{
  "tenant_name": "Intcloudsysops",
  "tenant_slug": "intcloudsysops",
  "schema_name": "intcloudsysops",
  "platform_domain": "op-sly.com",
  "public_url": "https://intcloudsysops.op-sly.com",
  "internal_port": 3005,
  "stack_type": "crm-platform",
  "pattern_ids": ["crm-platform", "agency-ops-stack"],
  "staff_login_path": "/admin/login",
  "workflows_count": 3,
  "pricing_per_unit": 0,
  "currency": "USD",
  "notes": "CloudOps CRM platform (agency). CRM = Twenty + Supabase intcloudsysops_* (GHL agency subscription cancelled). CRM Starter Pack (3 workflows) for account sync, deal pipeline, followups. n8n in VPS container tenant_intcloudsysops."
}
